{
  "version": "1.2",
  "project": {
    "title": "shotkit. The Explainer.",
    "duration_s": 90,
    "aspect": "16:9",
    "framework": "founder-explainer"
  },
  "brand_lock_ref": "brand-lock.snapshot.md",
  "series_lock": {
    "character": "no human subject. typography-driven explainer. document-control aesthetic with cream canvas, ink type, coral accents on signature beats",
    "environment": "operator-grade dashboard. cream background, JetBrains Mono headers, Inter body, single coral accent per beat. no clutter, no decorative imagery",
    "lighting": "even diffuse. no shadow rolloff. flat operator-doc grading throughout",
    "color_grade": "cream highlights (#F5F0E8), ink shadows (#2A2A32), coral (#D94F3A) reserved for signature beats only. no saturation drift"
  },
  "shots": [
    {
      "id": "shot_01",
      "beat": "pain",
      "start": 0.0,
      "end": 12.0,
      "framing": "WS",
      "angle": "eye-level",
      "motion": "static",
      "depth_of_field": "deep",
      "subject": "vague founder brief types into the left panel in JetBrains Mono. cursor blinks. then a chaos cut shows four image generators producing slightly off-brand outputs in a 2x2 grid. each tile renders the same shot with a different palette, framing, and font choice. the misfire is the visual.",
      "environment_ref": "series_lock.environment",
      "lighting_ref": "series_lock.lighting",
      "on_screen_text": "text_01",
      "vo": null,
      "rationale": "Cold open names the failure mode every founder recognizes. Vague brief plus model-roulette equals brand drift. The 2x2 grid does the work text cannot. Static framing keeps the focus on the diagnosis."
    },
    {
      "id": "shot_02",
      "beat": "reframe",
      "start": 12.0,
      "end": 30.0,
      "framing": "MS",
      "angle": "eye-level",
      "motion": "static",
      "depth_of_field": "deep",
      "subject": "five horizontal layers stack from top to bottom. each labeled in JetBrains Mono caps with 0.08em letter-spacing. brand lock, series lock, shot spec, text layer, generator adapter. each layer slides in from below on a 6-frame stagger. ink rules between. coral accent appears as a single dot on the brand lock layer when it lands.",
      "environment_ref": "series_lock.environment",
      "lighting_ref": "series_lock.lighting",
      "on_screen_text": "text_02",
      "vo": null,
      "rationale": "Architecture beat. The reader needs to see the layers exist before any claim about composability lands. Stack layout is the diagram doing the explanation. Coral accent on brand lock signals it as the load-bearing field."
    },
    {
      "id": "shot_03",
      "beat": "proof-1",
      "start": 30.0,
      "end": 50.0,
      "framing": "MS",
      "angle": "eye-level",
      "motion": "push",
      "depth_of_field": "deep",
      "subject": "split panel. left BRIEF column shows typewriter brief slowly assembling. right OUTPUT column starts empty with a pulsing waiting dot, then file tree assembles row by row in JetBrains Mono Regular 16pt. storyboard.md, shots.json, text-overlays.json, brand-lock.snapshot.md, prompts directory with seven adapter files, preview.html. coral dot appears next to preview.html on completion.",
      "environment_ref": "series_lock.environment",
      "lighting_ref": "series_lock.lighting",
      "on_screen_text": "text_03",
      "vo": null,
      "rationale": "The build moment is the centerpiece. Brief in, structured files out. This is the shot that earns the methodology claim. Same animation language as the social demo so brand consistency reads across both surfaces."
    },
    {
      "id": "shot_04",
      "beat": "proof-2",
      "start": 50.0,
      "end": 65.0,
      "framing": "MCU",
      "angle": "eye-level",
      "motion": "push",
      "depth_of_field": "shallow",
      "subject": "coral wipe expands radially from the preview.html dot. wipe reveals a rendered preview iframe scrolling vertically. the reader sees the actual shot cards from the 30-second example pass through frame, including framing, angle, motion, color-grade rows. subtle ten-percent vignette on edges.",
      "environment_ref": "series_lock.environment",
      "lighting_ref": "series_lock.lighting",
      "on_screen_text": "text_04",
      "vo": null,
      "rationale": "Reveal beat. The reader has now seen the methodology and the file outputs. The iframe shows the actual deliverable, not a mock. This is what separates the claim from the artifact."
    },
    {
      "id": "shot_05",
      "beat": "proof-3",
      "start": 65.0,
      "end": 80.0,
      "framing": "MS",
      "angle": "eye-level",
      "motion": "static",
      "depth_of_field": "deep",
      "subject": "single shot description card sits center-frame. seven generator adapter logos and labels fan out radially around it in a 280-pixel radius. midjourney, flux, ideogram, gpt image, nano banana, seedream, runway sora. lines connect center card to each adapter label in 1px ink. each adapter shows its prompt syntax appearing as a typewriter pass, all running simultaneously.",
      "environment_ref": "series_lock.environment",
      "lighting_ref": "series_lock.lighting",
      "on_screen_text": "text_05",
      "vo": null,
      "rationale": "Cross-generator demonstration. Same shot description compiles to seven different prompt syntaxes simultaneously. The visual proves model-agnosticism is structural, not aspirational."
    },
    {
      "id": "shot_06",
      "beat": "promise",
      "start": 80.0,
      "end": 90.0,
      "framing": "WS",
      "angle": "eye-level",
      "motion": "static",
      "depth_of_field": "deep",
      "subject": "full-frame typography. install command appears via type-on in JetBrains Mono Regular at 22pt, ink color, monospace block. below it the project tagline in Inter italic 500 18pt, color muted. coral period on the signature beat. door closes with the standard footer chrome holding.",
      "environment_ref": "series_lock.environment",
      "lighting_ref": "series_lock.lighting",
      "on_screen_text": ["text_06", "text_07"],
      "vo": null,
      "rationale": "Promise beat. The viewer has the diagnosis, the architecture, the artifact, and the proof. The CTA is one paste-into-terminal command. No friction surface, no signup, no email gate."
    }
  ]
}
