{
  "version": "1.0",
  "project": {
    "title": "WhyStrohm. How The System Actually Works",
    "duration_s": 60,
    "aspect": "9:16",
    "framework": "founder-explainer"
  },
  "brand_lock_ref": "brand-lock.snapshot.md",
  "series_lock": {
    "character": "founder, mid-thirties, salt-and-pepper hair, navy crewneck, speaking directly to camera, calm authoritative posture",
    "environment": "minimalist home office, white walls, oak desk, single houseplant, late afternoon",
    "lighting": "soft natural side-light, large window camera-left, warm afternoon golden hour, gentle shadow rolloff",
    "color_grade": "warm filmic, muted teal shadows, slight grain, cream highlights, deep navy shadows never crushed"
  },
  "shots": [
    {
      "id": "shot_01",
      "beat": "hook",
      "start": 0.0,
      "end": 2.0,
      "framing": "MCU",
      "angle": "eye-level",
      "motion": "static",
      "depth_of_field": "shallow",
      "subject": "founder, looking directly into camera, slight knowing smile, mid-statement",
      "environment_ref": "series_lock.environment",
      "lighting_ref": "series_lock.lighting",
      "on_screen_text": "text_01",
      "vo": "Most founders treat content like a hobby.",
      "rationale": "Hook is provocative but calm, voice carries the bite. Direct eye contact, MCU lock-in."
    },
    {
      "id": "shot_02",
      "beat": "stakes",
      "start": 2.0,
      "end": 8.0,
      "framing": "MS",
      "angle": "eye-level",
      "motion": "static",
      "depth_of_field": "shallow",
      "subject": "founder, gesturing slightly with one hand, explaining, eye contact maintained",
      "environment_ref": "series_lock.environment",
      "lighting_ref": "series_lock.lighting",
      "on_screen_text": null,
      "vo": "Then they wonder why every post feels like starting over. New idea, new angle, no compounding.",
      "rationale": "Stakes beat. Pulled out to MS to let the gesture read. VO does the work, no on-screen text needed."
    },
    {
      "id": "shot_03",
      "beat": "stakes",
      "start": 8.0,
      "end": 14.0,
      "framing": "ECU",
      "angle": "eye-level",
      "motion": "static",
      "depth_of_field": "shallow",
      "subject": "close on founder's eyes, considered expression, slight head tilt",
      "environment_ref": "series_lock.environment",
      "lighting_ref": "series_lock.lighting",
      "on_screen_text": "text_02",
      "vo": "It's not creativity. It's missing infrastructure.",
      "rationale": "ECU pulls the audience into the realization moment. Text reinforces the line that needs to land."
    },
    {
      "id": "shot_04",
      "beat": "insight",
      "start": 14.0,
      "end": 24.0,
      "framing": "MCU",
      "angle": "eye-level",
      "motion": "push",
      "depth_of_field": "shallow",
      "subject": "founder, leaning slightly forward, more energy in delivery, hands resting on desk",
      "environment_ref": "series_lock.environment",
      "lighting_ref": "series_lock.lighting",
      "on_screen_text": null,
      "vo": "Every brand has a voice. Most founders never extract it. So every post starts from scratch.",
      "rationale": "Insight beat, slow push as the thesis builds. VO is the load-bearing element here."
    },
    {
      "id": "shot_05",
      "beat": "insight",
      "start": 24.0,
      "end": 32.0,
      "framing": "MS",
      "angle": "eye-level",
      "motion": "static",
      "depth_of_field": "deep",
      "subject": "founder gestures toward laptop screen, kanban-style content pipeline visible, voice extraction interface, brand-lock file open in editor",
      "environment_ref": "series_lock.environment",
      "lighting_ref": "series_lock.lighting",
      "on_screen_text": "text_03",
      "vo": "Extract it once. Lock it in code. Now every post compounds.",
      "rationale": "Show the artifact. Text reinforces the three-step pattern. Deep DOF keeps the screen legible."
    },
    {
      "id": "shot_06",
      "beat": "proof",
      "start": 32.0,
      "end": 42.0,
      "framing": "MCU",
      "angle": "eye-level",
      "motion": "static",
      "depth_of_field": "shallow",
      "subject": "founder, calm steady delivery, eye contact, hands folded",
      "environment_ref": "series_lock.environment",
      "lighting_ref": "series_lock.lighting",
      "on_screen_text": "text_04",
      "vo": "One source becomes every format. Rendered from templates, so the tenth piece costs what the first did.",
      "rationale": "Proof beat, the mechanism in plain terms. The callout in the upper-third lets the viewer read it while the VO says it."
    },
    {
      "id": "shot_07",
      "beat": "insight",
      "start": 42.0,
      "end": 50.0,
      "framing": "MS",
      "angle": "eye-level",
      "motion": "pull",
      "depth_of_field": "shallow",
      "subject": "founder, slight smile, settled into the explanation, room visible around him",
      "environment_ref": "series_lock.environment",
      "lighting_ref": "series_lock.lighting",
      "on_screen_text": null,
      "vo": "Not because we work harder. Because the system runs.",
      "rationale": "Slow pull releases tension. The thesis lands. VO carries, text would dilute."
    },
    {
      "id": "shot_08",
      "beat": "cta",
      "start": 50.0,
      "end": 60.0,
      "framing": "MCU",
      "angle": "eye-level",
      "motion": "static",
      "depth_of_field": "shallow",
      "subject": "founder, calm, looks directly into camera one more time, almost-smile, settled",
      "environment_ref": "series_lock.environment",
      "lighting_ref": "series_lock.lighting",
      "on_screen_text": "text_05",
      "vo": "If this sounds like the version of content you actually want, run a free scan.",
      "rationale": "CTA beat. Static MCU brings it home. URL holds in lower-third for full read-twice duration."
    }
  ]
}
