{
  "version": "1.0",
  "project": {
    "title": "WhyStrohm. The Content Infrastructure Pitch",
    "duration_s": 30,
    "aspect": "9:16",
    "framework": "pain-reframe-promise"
  },
  "brand_lock_ref": "brand-lock.snapshot.md",
  "series_lock": {
    "character": "founder, mid-thirties, salt-and-pepper hair, navy crewneck, calm posture, working at laptop",
    "environment": "minimalist home office, white walls, oak desk, single houseplant, no decor clutter",
    "lighting": "soft natural side-light, large window camera-left, warm afternoon golden hour, gentle shadow rolloff",
    "color_grade": "warm filmic, muted teal shadows, slight grain, cream highlights, deep navy shadows never crushed"
  },
  "shots": [
    {
      "id": "shot_01",
      "beat": "hook",
      "start": 0.0,
      "end": 2.0,
      "framing": "MCU",
      "angle": "eye-level",
      "motion": "static",
      "depth_of_field": "shallow",
      "subject": "founder, mid-thirties, salt-and-pepper hair, navy crewneck, looking directly into camera, neutral expression, slightly tired",
      "environment_ref": "series_lock.environment",
      "lighting_ref": "series_lock.lighting",
      "on_screen_text": "text_01",
      "vo": null,
      "rationale": "Cold open, direct eye contact establishes parasocial trust. Static framing keeps the hook simple, text does the work."
    },
    {
      "id": "shot_02",
      "beat": "pain",
      "start": 2.0,
      "end": 7.0,
      "framing": "MS",
      "angle": "high",
      "motion": "static",
      "depth_of_field": "deep",
      "subject": "founder at laptop, scrolling social feed, content tiles glowing on screen, slight slump in shoulders, mug of coffee mid-distance",
      "environment_ref": "series_lock.environment",
      "lighting_ref": "series_lock.lighting",
      "on_screen_text": "text_02",
      "vo": null,
      "rationale": "High angle subtly diminishes the subject, pain beat. Deep DOF keeps the messy social feed legible. Subject left-weighted, text reserves right two-thirds."
    },
    {
      "id": "shot_03",
      "beat": "pain",
      "start": 7.0,
      "end": 11.0,
      "framing": "ECU",
      "angle": "eye-level",
      "motion": "static",
      "depth_of_field": "shallow",
      "subject": "close on founder's hand hovering over laptop trackpad, frozen, not moving",
      "environment_ref": "series_lock.environment",
      "lighting_ref": "series_lock.lighting",
      "on_screen_text": null,
      "vo": null,
      "rationale": "Hand frozen above trackpad is the visual symbol of decision paralysis. Wordless beat, let the image carry the pain before the reframe."
    },
    {
      "id": "shot_04",
      "beat": "reframe",
      "start": 11.0,
      "end": 16.0,
      "framing": "MCU",
      "angle": "eye-level",
      "motion": "push",
      "depth_of_field": "shallow",
      "subject": "founder, same posture, looking at camera, expression shifts from tired to clear, small almost-smile",
      "environment_ref": "series_lock.environment",
      "lighting_ref": "series_lock.lighting",
      "on_screen_text": "text_03",
      "vo": null,
      "rationale": "Slow push as the reframe lands. Same character, same environment, only the expression changes. The change is the point."
    },
    {
      "id": "shot_05",
      "beat": "proof",
      "start": 16.0,
      "end": 20.0,
      "framing": "MS",
      "angle": "eye-level",
      "motion": "static",
      "depth_of_field": "deep",
      "subject": "founder gestures toward laptop screen, kanban-style content pipeline visible, organized columns, clean structure",
      "environment_ref": "series_lock.environment",
      "lighting_ref": "series_lock.lighting",
      "on_screen_text": "text_04",
      "vo": null,
      "rationale": "Proof beat, show the system, not the result. The kanban metaphor is recognizable to operators. Subject right-weighted, text upper-third."
    },
    {
      "id": "shot_06",
      "beat": "promise",
      "start": 20.0,
      "end": 26.0,
      "framing": "MCU",
      "angle": "eye-level",
      "motion": "static",
      "depth_of_field": "shallow",
      "subject": "founder, calm composed posture, fully present, slight smile, hands folded on desk",
      "environment_ref": "series_lock.environment",
      "lighting_ref": "series_lock.lighting",
      "on_screen_text": "text_05",
      "vo": null,
      "rationale": "Promise beat, the after-state is the same person, just calmer. Static frame holds the moment. Text carries the plain promise."
    },
    {
      "id": "shot_07",
      "beat": "cta",
      "start": 26.0,
      "end": 30.0,
      "framing": "MS",
      "angle": "eye-level",
      "motion": "static",
      "depth_of_field": "deep",
      "subject": "founder, neutral posture, room visible behind, calm presence, gentle eye contact with camera",
      "environment_ref": "series_lock.environment",
      "lighting_ref": "series_lock.lighting",
      "on_screen_text": "text_06",
      "vo": null,
      "rationale": "CTA beat. Pulled out to MS to give text the breathing room. Subject centered, text lower-third with URL. No motion, let it land."
    }
  ]
}
